{
  "kind": "class",
  "name": "NetworkView",
  "description": "Represents a network view on a map object that has the \"networked\" flag. Note1: messages sent from a mapobjects network view are not component scoped, all components will receive the same message. If you intend for a mapobject to have multiple message sending components, preface the message with the component name to determine scope. Note2: Rooms and Players have bandwidth limits, exceeding the limits via CL will result in either the player being kicked or the room being shut down. When possible, use basic message passing for state sync and then run logic locally instead of repeatedly sending state over the network. Also avoid cases where message sending increases heavily with the number of players in the room.",
  "extends": [
    "Object"
  ],
  "instanceFields": [
    {
      "label": "SyncTransforms",
      "type": {
        "name": "bool",
        "typeArguments": []
      },
      "description": "Whether or not the object's Transform is synced. If PhotonSync is not initialized yet, it will defer until it is set.",
      "readonly": false,
      "private": false
    },
    {
      "label": "Owner",
      "type": {
        "name": "Player",
        "typeArguments": []
      },
      "description": "The network view's owner.",
      "readonly": true,
      "private": false
    }
  ],
  "instanceMethods": [
    {
      "label": "Transfer",
      "returnType": {
        "name": "void",
        "typeArguments": []
      },
      "description": "Owner only. Transfer ownership of this NetworkView to another player.",
      "parameters": [
        {
          "name": "player",
          "type": {
            "name": "Player",
            "typeArguments": []
          },
          "description": "",
          "isOptional": false,
          "isVariadic": false
        }
      ],
      "kind": "function"
    },
    {
      "label": "SendMessage",
      "returnType": {
        "name": "void",
        "typeArguments": []
      },
      "description": "Send a message to a target player. This will be received in any of the MapObject attached components through the OnNetworkMessage callback.",
      "parameters": [
        {
          "name": "target",
          "type": {
            "name": "Player",
            "typeArguments": []
          },
          "description": "",
          "isOptional": false,
          "isVariadic": false
        },
        {
          "name": "msg",
          "type": {
            "name": "string",
            "typeArguments": []
          },
          "description": "",
          "isOptional": false,
          "isVariadic": false
        }
      ],
      "kind": "function"
    },
    {
      "label": "SendMessageAll",
      "returnType": {
        "name": "void",
        "typeArguments": []
      },
      "description": "Send a message to all players including myself.",
      "parameters": [
        {
          "name": "msg",
          "type": {
            "name": "string",
            "typeArguments": []
          },
          "description": "",
          "isOptional": false,
          "isVariadic": false
        }
      ],
      "kind": "function"
    },
    {
      "label": "SendMessageOthers",
      "returnType": {
        "name": "void",
        "typeArguments": []
      },
      "description": "Send a message to players excluding myself.",
      "parameters": [
        {
          "name": "msg",
          "type": {
            "name": "string",
            "typeArguments": []
          },
          "description": "",
          "isOptional": false,
          "isVariadic": false
        }
      ],
      "kind": "function"
    },
    {
      "label": "SendStream",
      "returnType": {
        "name": "void",
        "typeArguments": []
      },
      "description": "Send an object to the network sync stream. This represents sending data from the object owner to all non-owner observers, and should only be called in the SendNetworkStream callback in the attached component. It only works with some object types: primitives and Vector3.",
      "parameters": [
        {
          "name": "obj",
          "type": {
            "name": "Object",
            "typeArguments": []
          },
          "description": "",
          "isOptional": false,
          "isVariadic": false
        }
      ],
      "kind": "function"
    },
    {
      "label": "ReceiveStream",
      "returnType": {
        "name": "Object",
        "typeArguments": []
      },
      "description": "Receive an object through the network sync stream. This represents receiving data from the object owner as a non-owner observer, and should only be called in the OnNetworkStream callback.",
      "parameters": [],
      "kind": "function"
    }
  ],
  "staticFields": [],
  "staticMethods": [],
  "constructors": []
}