{
  "kind": "extension",
  "name": "Cutscene",
  "description": "",
  "extends": [
    "Object"
  ],
  "instanceFields": [],
  "instanceMethods": [],
  "staticFields": [],
  "staticMethods": [
    {
      "label": "Start",
      "returnType": {
        "name": "void",
        "typeArguments": []
      },
      "description": "Start a cutscene",
      "parameters": [
        {
          "name": "name",
          "type": {
            "name": "string",
            "typeArguments": []
          },
          "description": "The name of the cutscene class to start.",
          "isOptional": false,
          "isVariadic": false
        },
        {
          "name": "full",
          "type": {
            "name": "bool",
            "typeArguments": []
          },
          "description": "If true, enables full cutscene mode.",
          "isOptional": false,
          "isVariadic": false
        }
      ],
      "kind": "function"
    },
    {
      "label": "ShowDialogue",
      "returnType": {
        "name": "void",
        "typeArguments": []
      },
      "description": "Show a dialogue box",
      "parameters": [
        {
          "name": "icon",
          "type": {
            "name": "string",
            "typeArguments": []
          },
          "description": "The icon name to display.",
          "isOptional": false,
          "isVariadic": false
        },
        {
          "name": "title",
          "type": {
            "name": "string",
            "typeArguments": []
          },
          "description": "The title of the dialogue.",
          "isOptional": false,
          "isVariadic": false
        },
        {
          "name": "content",
          "type": {
            "name": "string",
            "typeArguments": []
          },
          "description": "The content text of the dialogue.",
          "isOptional": false,
          "isVariadic": false
        }
      ],
      "kind": "function"
    },
    {
      "label": "ShowDialogueForTime",
      "returnType": {
        "name": "void",
        "typeArguments": []
      },
      "description": "Show a dialogue box for a certain amount of time",
      "parameters": [
        {
          "name": "icon",
          "type": {
            "name": "string",
            "typeArguments": []
          },
          "description": "The icon name to display.",
          "isOptional": false,
          "isVariadic": false
        },
        {
          "name": "title",
          "type": {
            "name": "string",
            "typeArguments": []
          },
          "description": "The title of the dialogue.",
          "isOptional": false,
          "isVariadic": false
        },
        {
          "name": "content",
          "type": {
            "name": "string",
            "typeArguments": []
          },
          "description": "The content text of the dialogue.",
          "isOptional": false,
          "isVariadic": false
        },
        {
          "name": "time",
          "type": {
            "name": "float",
            "typeArguments": []
          },
          "description": "The duration in seconds to show the dialogue.",
          "isOptional": false,
          "isVariadic": false
        }
      ],
      "kind": "function"
    },
    {
      "label": "HideDialogue",
      "returnType": {
        "name": "void",
        "typeArguments": []
      },
      "description": "Hide the dialogue box",
      "parameters": [],
      "kind": "function"
    }
  ],
  "constructors": []
}