{
  "kind": "class",
  "name": "TextField",
  "description": "A UI element that lets the user input and edit text",
  "extends": [
    "VisualElement"
  ],
  "instanceFields": [
    {
      "label": "IsDelayed",
      "type": {
        "name": "bool",
        "typeArguments": []
      },
      "description": "If true, the value property isn't updated until either the Enter key is pressed or the TextField loses focus",
      "readonly": false,
      "private": false
    },
    {
      "label": "Multiline",
      "type": {
        "name": "bool",
        "typeArguments": []
      },
      "description": "If true, the TextField supports multiple lines of text",
      "readonly": false,
      "private": false
    },
    {
      "label": "Label",
      "type": {
        "name": "string",
        "typeArguments": []
      },
      "description": "The label text displayed next to the TextField",
      "readonly": false,
      "private": false
    },
    {
      "label": "Value",
      "type": {
        "name": "string",
        "typeArguments": []
      },
      "description": "The value of the TextField",
      "readonly": false,
      "private": false
    },
    {
      "label": "SelectionColor",
      "type": {
        "name": "Color",
        "typeArguments": []
      },
      "description": "Color used to highlight selected text inside the field",
      "readonly": false,
      "private": false
    },
    {
      "label": "CursorColor",
      "type": {
        "name": "Color",
        "typeArguments": []
      },
      "description": "Color of the text cursor (caret)",
      "readonly": false,
      "private": false
    }
  ],
  "instanceMethods": [
    {
      "label": "RegisterValueChangedEventCallback",
      "returnType": {
        "name": "TextField",
        "typeArguments": []
      },
      "description": "Registers a callback to be invoked when the value of the TextField changes",
      "parameters": [
        {
          "name": "changeEvent",
          "type": {
            "name": "function",
            "typeArguments": []
          },
          "description": "",
          "isOptional": false,
          "isVariadic": false
        }
      ],
      "kind": "function"
    },
    {
      "label": "SetValueWithoutNotify",
      "returnType": {
        "name": "void",
        "typeArguments": []
      },
      "description": "Sets the value of the TextField without triggering any change events",
      "parameters": [
        {
          "name": "value",
          "type": {
            "name": "string",
            "typeArguments": []
          },
          "description": "",
          "isOptional": false,
          "isVariadic": false
        }
      ],
      "kind": "function"
    }
  ],
  "staticFields": [],
  "staticMethods": [],
  "constructors": []
}