{
  "kind": "extension",
  "name": "PersistentData",
  "description": "Store and retrieve persistent data. Persistent data can be saved and loaded from file. Supports float, int, string, and bool types. Note that any game mode may use the same file names, so it is recommended that you choose unique file names when saving and loading. Saved files are located in Documents/Aottg2/PersistentData.",
  "extends": [
    "Object"
  ],
  "instanceFields": [],
  "instanceMethods": [],
  "staticFields": [],
  "staticMethods": [
    {
      "label": "SetProperty",
      "returnType": {
        "name": "void",
        "typeArguments": []
      },
      "description": "Sets the property with given name to the object value. Valid value types are float, string, bool, and int.",
      "parameters": [
        {
          "name": "property",
          "type": {
            "name": "string",
            "typeArguments": []
          },
          "description": "",
          "isOptional": false,
          "isVariadic": false
        },
        {
          "name": "value",
          "type": {
            "name": "Object",
            "typeArguments": []
          },
          "description": "",
          "isOptional": false,
          "isVariadic": false
        }
      ],
      "kind": "function"
    },
    {
      "label": "GetProperty",
      "returnType": {
        "name": "Object",
        "typeArguments": []
      },
      "description": "Gets the property with given name. If property does not exist, returns defaultValue.",
      "parameters": [
        {
          "name": "property",
          "type": {
            "name": "string",
            "typeArguments": []
          },
          "description": "",
          "isOptional": false,
          "isVariadic": false
        },
        {
          "name": "defaultValue",
          "type": {
            "name": "Object",
            "typeArguments": []
          },
          "description": "",
          "isOptional": false,
          "isVariadic": false
        }
      ],
      "kind": "function"
    },
    {
      "label": "LoadFromFile",
      "returnType": {
        "name": "void",
        "typeArguments": []
      },
      "description": "Loads persistent data from given file name. If encrypted is true, will treat the file as having been saved as encrypted.",
      "parameters": [
        {
          "name": "fileName",
          "type": {
            "name": "string",
            "typeArguments": []
          },
          "description": "",
          "isOptional": false,
          "isVariadic": false
        },
        {
          "name": "encrypted",
          "type": {
            "name": "bool",
            "typeArguments": []
          },
          "description": "",
          "isOptional": false,
          "isVariadic": false
        }
      ],
      "kind": "function"
    },
    {
      "label": "SaveToFile",
      "returnType": {
        "name": "void",
        "typeArguments": []
      },
      "description": "Saves current persistent data to given file name. If encrypted is true, will also encrypt the file instead of using plaintext.",
      "parameters": [
        {
          "name": "fileName",
          "type": {
            "name": "string",
            "typeArguments": []
          },
          "description": "",
          "isOptional": false,
          "isVariadic": false
        },
        {
          "name": "encrypted",
          "type": {
            "name": "bool",
            "typeArguments": []
          },
          "description": "",
          "isOptional": false,
          "isVariadic": false
        }
      ],
      "kind": "function"
    },
    {
      "label": "Clear",
      "returnType": {
        "name": "void",
        "typeArguments": []
      },
      "description": "Clears current persistent data.",
      "parameters": [],
      "kind": "function"
    },
    {
      "label": "IsValidFileName",
      "returnType": {
        "name": "bool",
        "typeArguments": []
      },
      "description": "Determines whether or not the given fileName will be allowed for use when saving/loading a file.",
      "parameters": [
        {
          "name": "fileName",
          "type": {
            "name": "string",
            "typeArguments": []
          },
          "description": "",
          "isOptional": false,
          "isVariadic": false
        }
      ],
      "kind": "function"
    },
    {
      "label": "FileExists",
      "returnType": {
        "name": "bool",
        "typeArguments": []
      },
      "description": "Determines whether the file given already exists. Throws an error if given an invalid file name.",
      "parameters": [
        {
          "name": "fileName",
          "type": {
            "name": "string",
            "typeArguments": []
          },
          "description": "",
          "isOptional": false,
          "isVariadic": false
        }
      ],
      "kind": "function"
    }
  ],
  "constructors": []
}