{
  "kind": "class",
  "name": "Object",
  "description": "The base type of all objects in the game.",
  "instanceFields": [
    {
      "label": "Type",
      "type": {
        "name": "string",
        "typeArguments": []
      },
      "description": "The type of the object (such as \"Human\")",
      "readonly": false,
      "private": false
    },
    {
      "label": "IsCharacter",
      "type": {
        "name": "bool",
        "typeArguments": []
      },
      "description": "Whether or not the object is a Character type or any of its inheritors",
      "readonly": false,
      "private": false
    }
  ],
  "instanceMethods": [],
  "staticFields": [],
  "staticMethods": [],
  "constructors": []
}